[
  {
    "schema": "stegverse.intr.hop_receipt/v1",
    "receipt_id": "intrrcpt-return-example-001",
    "packet_id": "intrpkt-return-example-001",
    "hop_index": 0,
    "direction": "RETURN",
    "from_role": "ENDPOINT",
    "to_role": "EXTERNAL_NETWORK",
    "operation_hash": "sha256:dddddddddddddddddddddddddddddddddddddddddddddddddddddddddddddddd",
    "payload_hash": "sha256:eeeeeeeeeeeeeeeeeeeeeeeeeeeeeeeeeeeeeeeeeeeeeeeeeeeeeeeeeeeeeeee",
    "prior_receipt_hash": null,
    "boundary_identity_ref": "identity:external_network-return-example",
    "boundary_verification": "VERIFIED",
    "transition_state": "FORWARDED",
    "secret_plaintext_present": false,
    "authority_transfer": false,
    "recorded_at": "2026-08-24T20:30:00-05:00",
    "receipt_hash": "sha256:65f5b1a0efa61ef9a330b858d4027b505e237222080d56b7560b740712196fe4"
  },
  {
    "schema": "stegverse.intr.hop_receipt/v1",
    "receipt_id": "intrrcpt-return-example-002",
    "packet_id": "intrpkt-return-example-001",
    "hop_index": 1,
    "direction": "RETURN",
    "from_role": "EXTERNAL_NETWORK",
    "to_role": "DEVICE",
    "operation_hash": "sha256:dddddddddddddddddddddddddddddddddddddddddddddddddddddddddddddddd",
    "payload_hash": "sha256:eeeeeeeeeeeeeeeeeeeeeeeeeeeeeeeeeeeeeeeeeeeeeeeeeeeeeeeeeeeeeeee",
    "prior_receipt_hash": "sha256:65f5b1a0efa61ef9a330b858d4027b505e237222080d56b7560b740712196fe4",
    "boundary_identity_ref": "identity:device-return-example",
    "boundary_verification": "VERIFIED",
    "transition_state": "FORWARDED",
    "secret_plaintext_present": false,
    "authority_transfer": false,
    "recorded_at": "2026-08-24T20:31:00-05:00",
    "receipt_hash": "sha256:6376b10a72fbc1660dba4639a1a823591753973965ceef0d6f54b277521786e2"
  },
  {
    "schema": "stegverse.intr.hop_receipt/v1",
    "receipt_id": "intrrcpt-return-example-003",
    "packet_id": "intrpkt-return-example-001",
    "hop_index": 2,
    "direction": "RETURN",
    "from_role": "DEVICE",
    "to_role": "KV",
    "operation_hash": "sha256:dddddddddddddddddddddddddddddddddddddddddddddddddddddddddddddddd",
    "payload_hash": "sha256:eeeeeeeeeeeeeeeeeeeeeeeeeeeeeeeeeeeeeeeeeeeeeeeeeeeeeeeeeeeeeeee",
    "prior_receipt_hash": "sha256:6376b10a72fbc1660dba4639a1a823591753973965ceef0d6f54b277521786e2",
    "boundary_identity_ref": "identity:kv-return-example",
    "boundary_verification": "VERIFIED",
    "transition_state": "FORWARDED",
    "secret_plaintext_present": false,
    "authority_transfer": false,
    "recorded_at": "2026-08-24T20:32:00-05:00",
    "receipt_hash": "sha256:e786537f04a9f20248320a436b7eaa5dae7b1b6538d11fa51a564c6bd7ac46fe"
  },
  {
    "schema": "stegverse.intr.hop_receipt/v1",
    "receipt_id": "intrrcpt-return-example-004",
    "packet_id": "intrpkt-return-example-001",
    "hop_index": 3,
    "direction": "RETURN",
    "from_role": "KV",
    "to_role": "SKAP",
    "operation_hash": "sha256:dddddddddddddddddddddddddddddddddddddddddddddddddddddddddddddddd",
    "payload_hash": "sha256:eeeeeeeeeeeeeeeeeeeeeeeeeeeeeeeeeeeeeeeeeeeeeeeeeeeeeeeeeeeeeeee",
    "prior_receipt_hash": "sha256:e786537f04a9f20248320a436b7eaa5dae7b1b6538d11fa51a564c6bd7ac46fe",
    "boundary_identity_ref": "identity:skap-return-example",
    "boundary_verification": "VERIFIED",
    "transition_state": "TERMINAL",
    "secret_plaintext_present": false,
    "authority_transfer": false,
    "recorded_at": "2026-08-24T20:33:00-05:00",
    "receipt_hash": "sha256:908cd30fd01ca9beace1c1c0233146a698d7e3f7ea2870793011f513a0d8fe57"
  }
]
