[
  {
    "schema": "stegverse.intr.hop_receipt/v1",
    "receipt_id": "intrrcpt-example-001",
    "packet_id": "intrpkt-example-001",
    "hop_index": 0,
    "direction": "FORWARD",
    "from_role": "SKAP",
    "to_role": "KV",
    "operation_hash": "sha256:aaaaaaaaaaaaaaaaaaaaaaaaaaaaaaaaaaaaaaaaaaaaaaaaaaaaaaaaaaaaaaaa",
    "payload_hash": "sha256:bbbbbbbbbbbbbbbbbbbbbbbbbbbbbbbbbbbbbbbbbbbbbbbbbbbbbbbbbbbbbbbb",
    "prior_receipt_hash": null,
    "boundary_identity_ref": "identity:kv-example",
    "boundary_verification": "VERIFIED",
    "transition_state": "FORWARDED",
    "secret_plaintext_present": false,
    "authority_transfer": false,
    "recorded_at": "2026-08-24T19:46:00-05:00",
    "receipt_hash": "sha256:64d3b0b62d16533c77472cb932002d024e0afe43a6f7893712fce16fa8a16ed8"
  },
  {
    "schema": "stegverse.intr.hop_receipt/v1",
    "receipt_id": "intrrcpt-example-002",
    "packet_id": "intrpkt-example-001",
    "hop_index": 1,
    "direction": "FORWARD",
    "from_role": "KV",
    "to_role": "DEVICE",
    "operation_hash": "sha256:aaaaaaaaaaaaaaaaaaaaaaaaaaaaaaaaaaaaaaaaaaaaaaaaaaaaaaaaaaaaaaaa",
    "payload_hash": "sha256:bbbbbbbbbbbbbbbbbbbbbbbbbbbbbbbbbbbbbbbbbbbbbbbbbbbbbbbbbbbbbbbb",
    "prior_receipt_hash": "sha256:64d3b0b62d16533c77472cb932002d024e0afe43a6f7893712fce16fa8a16ed8",
    "boundary_identity_ref": "identity:device-example",
    "boundary_verification": "VERIFIED",
    "transition_state": "FORWARDED",
    "secret_plaintext_present": false,
    "authority_transfer": false,
    "recorded_at": "2026-08-24T19:47:00-05:00",
    "receipt_hash": "sha256:b70e2bb7d25df0339920604520a1fb42478b7e6d26e73743d881992b049088ed"
  },
  {
    "schema": "stegverse.intr.hop_receipt/v1",
    "receipt_id": "intrrcpt-example-003",
    "packet_id": "intrpkt-example-001",
    "hop_index": 2,
    "direction": "FORWARD",
    "from_role": "DEVICE",
    "to_role": "EXTERNAL_NETWORK",
    "operation_hash": "sha256:aaaaaaaaaaaaaaaaaaaaaaaaaaaaaaaaaaaaaaaaaaaaaaaaaaaaaaaaaaaaaaaa",
    "payload_hash": "sha256:bbbbbbbbbbbbbbbbbbbbbbbbbbbbbbbbbbbbbbbbbbbbbbbbbbbbbbbbbbbbbbbb",
    "prior_receipt_hash": "sha256:b70e2bb7d25df0339920604520a1fb42478b7e6d26e73743d881992b049088ed",
    "boundary_identity_ref": "identity:external_network-example",
    "boundary_verification": "VERIFIED",
    "transition_state": "FORWARDED",
    "secret_plaintext_present": false,
    "authority_transfer": false,
    "recorded_at": "2026-08-24T19:48:00-05:00",
    "receipt_hash": "sha256:ee8cb894dd1145bcae71eb825b48a356716a3aa538db870fd2fc2eba74a930d9"
  },
  {
    "schema": "stegverse.intr.hop_receipt/v1",
    "receipt_id": "intrrcpt-example-004",
    "packet_id": "intrpkt-example-001",
    "hop_index": 3,
    "direction": "FORWARD",
    "from_role": "EXTERNAL_NETWORK",
    "to_role": "ENDPOINT",
    "operation_hash": "sha256:aaaaaaaaaaaaaaaaaaaaaaaaaaaaaaaaaaaaaaaaaaaaaaaaaaaaaaaaaaaaaaaa",
    "payload_hash": "sha256:bbbbbbbbbbbbbbbbbbbbbbbbbbbbbbbbbbbbbbbbbbbbbbbbbbbbbbbbbbbbbbbb",
    "prior_receipt_hash": "sha256:ee8cb894dd1145bcae71eb825b48a356716a3aa538db870fd2fc2eba74a930d9",
    "boundary_identity_ref": "identity:endpoint-example",
    "boundary_verification": "VERIFIED",
    "transition_state": "TERMINAL",
    "secret_plaintext_present": false,
    "authority_transfer": false,
    "recorded_at": "2026-08-24T19:49:00-05:00",
    "receipt_hash": "sha256:dfbe069a3fb30f436681f0d2a179ced3ab7fa42da80d22eb6ec725c9c8a1e97c"
  }
]
